{
  "$schema": "../../schemas/enemy_def_schema.json",
  "id": "archer",
  "displayName": "Archer",
  "width": 32,
  "height": 48,
  "physicsHeight": 40,
  "baseHp": 5,
  "damage": 1,
  "speed": 90.0,
  "detectionRange": 320.0,
  "attackRange": 200.0,
  "attackWindupSeconds": 0.8,
  "fleeHpThreshold": 0.0,
  "knockoutDurationTicks": 120,
  "xpReward": 15,
  "currencyDrop": { "min": 1, "max": 3, "chance": 0.4 },
  "aiProfile": "ranged",
  "animationKey": "enemy_archer",
  "spawnWeight": 6,
  "biomeAffinity": ["forest", "earth"],
  "tags": ["grounded", "ranged"]
}
