{
  "$schema": "../../schemas/enemy_def_schema.json",
  "id": "slime_red",
  "displayName": "Red Slime",
  "width": 40,
  "height": 32,
  "physicsHeight": 28,
  "baseHp": 5,
  "damage": 2,
  "speed": 68.0,
  "detectionRange": 180.0,
  "attackRange": 44.0,
  "attackWindupSeconds": 0.35,
  "fleeHpThreshold": 0.0,
  "knockoutDurationTicks": 90,
  "xpReward": 9,
  "currencyDrop": { "min": 0, "max": 2, "chance": 0.3 },
  "aiProfile": "standard",
  "animationKey": "enemy_slime_red",
  "spawnWeight": 5,
  "biomeAffinity": ["lava", "fire"],
  "tags": ["grounded", "melee", "boss_spawn"]
}
